{
  "artifacts": [
    {
      "path": "artifacts/scientific/smoke/prepare_paper_source_native_stdout.json",
      "type": "prepare_paper_source_native_stdout_json"
    },
    {
      "path": "artifacts/scientific/smoke/prepare_paper_source_native_stderr.txt",
      "type": "prepare_paper_source_native_stderr"
    },
    {
      "path": "artifacts/scientific/smoke/prepare_paper_source_native_payload.json",
      "type": "prepare_paper_source_native_payload_json"
    },
    {
      "path": "artifacts/scientific/smoke/research_memory_update.json",
      "type": "research_memory_update_json"
    },
    {
      "path": "artifacts/scientific/smoke/research_graph_update.json",
      "type": "research_graph_update_json"
    },
    {
      "path": "artifacts/scientific/smoke/ingest_final_source_registration_boundary.json",
      "type": "ingest_final_source_registration_boundary_json"
    },
    {
      "path": "artifacts/scientific/smoke/ingest_paper_source_provider_runtime_proof.json",
      "type": "provider_source_runtime_proof_manifest_json"
    },
    {
      "path": "artifacts/scientific/smoke/research_paper.json",
      "type": "solar_evidence_json"
    }
  ],
  "inputs": {
    "paper_path": "plugins/autosci/tests/fixtures/sample_paper.md"
  },
  "limitations": [
    "Solar AutoSci prepared the source without warnings.",
    "Ingest final source registration incomplete: wiki_registration_ready"
  ],
  "node_id": "node-ingest-paper",
  "outputs": {
    "final_source_registration_boundary": {
      "checks": [
        {
          "name": "source_preparation_verified",
          "status": "ok"
        },
        {
          "name": "parse_quality_ready",
          "status": "ok"
        },
        {
          "name": "raw_artifact_provenance_ready",
          "status": "ok"
        },
        {
          "name": "downstream_handoff_ready",
          "status": "ok"
        },
        {
          "name": "wiki_registration_ready",
          "status": "missing"
        }
      ],
      "downstream_handoff_ready": true,
      "final_registration_ready": false,
      "graph_sidecar_ready": true,
      "memory_sidecar_ready": true,
      "missing": [
        "wiki_registration_ready"
      ],
      "paper_id": "paper-sample-paper",
      "parse_quality_ready": true,
      "raw_artifact_provenance_ready": true,
      "schema": "autosci_ingest_final_source_registration_boundary.v1",
      "sidecar_evidence_paths": [
        "artifacts/scientific/smoke/research_memory_update.json",
        "artifacts/scientific/smoke/research_graph_update.json"
      ],
      "source_preparation_verified": true,
      "status": "ingest_source_registration_incomplete",
      "wiki_registration": {
        "context_brief_path": "artifacts/autosci/workspace/wiki/graph/context_brief.md",
        "context_rebuilt": false,
        "graph_edges_path": "artifacts/autosci/workspace/wiki/graph/edges.jsonl",
        "graph_registered": false,
        "index_path": "artifacts/autosci/workspace/wiki/index.md",
        "index_rebuilt": false,
        "log_path": "artifacts/autosci/workspace/wiki/log.md",
        "log_registered": false,
        "paper_page": "artifacts/autosci/workspace/wiki/papers/paper-sample-paper.md",
        "paper_registered": false,
        "wiki_root": "artifacts/autosci/workspace/wiki"
      },
      "wiki_registration_ready": false
    },
    "paper": {
      "abstract": "This fixture paper exists only to test Solar-native adapter boundaries.",
      "final_source_registration_boundary": {
        "checks": [
          {
            "name": "source_preparation_verified",
            "status": "ok"
          },
          {
            "name": "parse_quality_ready",
            "status": "ok"
          },
          {
            "name": "raw_artifact_provenance_ready",
            "status": "ok"
          },
          {
            "name": "downstream_handoff_ready",
            "status": "ok"
          },
          {
            "name": "wiki_registration_ready",
            "status": "missing"
          }
        ],
        "downstream_handoff_ready": true,
        "final_registration_ready": false,
        "graph_sidecar_ready": true,
        "memory_sidecar_ready": true,
        "missing": [
          "wiki_registration_ready"
        ],
        "paper_id": "paper-sample-paper",
        "parse_quality_ready": true,
        "raw_artifact_provenance_ready": true,
        "schema": "autosci_ingest_final_source_registration_boundary.v1",
        "sidecar_evidence_paths": [
          "artifacts/scientific/smoke/research_memory_update.json",
          "artifacts/scientific/smoke/research_graph_update.json"
        ],
        "source_preparation_verified": true,
        "status": "ingest_source_registration_incomplete",
        "wiki_registration": {
          "context_brief_path": "artifacts/autosci/workspace/wiki/graph/context_brief.md",
          "context_rebuilt": false,
          "graph_edges_path": "artifacts/autosci/workspace/wiki/graph/edges.jsonl",
          "graph_registered": false,
          "index_path": "artifacts/autosci/workspace/wiki/index.md",
          "index_rebuilt": false,
          "log_path": "artifacts/autosci/workspace/wiki/log.md",
          "log_registered": false,
          "paper_page": "artifacts/autosci/workspace/wiki/papers/paper-sample-paper.md",
          "paper_registered": false,
          "wiki_root": "artifacts/autosci/workspace/wiki"
        },
        "wiki_registration_ready": false
      },
      "identifiers": {
        "native_prepare_status": "completed",
        "source_fetch_status": "not_applicable",
        "source_prepare_status": "completed"
      },
      "paper_id": "paper-sample-paper",
      "parse_status": "parsed",
      "preparation": {
        "abstract_excerpt": "",
        "artifacts": [],
        "arxiv_id": "",
        "canonical_ingest_path": "plugins/autosci/tests/fixtures/sample_paper.md",
        "extracted_text_path": null,
        "ingest_format": "md",
        "native_prepare_paper_source": {
          "allow_network_fetch": true,
          "canonical_ingest_path": "raw/input/sample_paper.md",
          "ok": true,
          "prepared_path": null,
          "raw_root": "/Users/jamesyuan/Developer/Github Repos (On Git)/BetterSolar/docs/testing/test-runs/20260710-0121-qa-full-audit/tmp/eligible-full-phase-v3/temp/eligible-0007/pytest/test_phase9_ingest_writes_foun0/artifacts/autosci/workspace/raw",
          "schema": "autosci_prepare_paper_source_cli.v1",
          "source_path": "raw/input/sample_paper.md",
          "status": "completed"
        },
        "original_format": "md",
        "prepared_path": null,
        "source_fetch_status": "not_applicable",
        "source_path": "plugins/autosci/tests/fixtures/sample_paper.md",
        "status": "completed",
        "title": "",
        "warnings": []
      },
      "sections": [
        {
          "section_id": "abstract",
          "source_anchor": "sample_paper.md#abstract",
          "text": "This fixture paper exists only to test Solar-native adapter boundaries.",
          "title": "Abstract"
        },
        {
          "section_id": "method",
          "source_anchor": "sample_paper.md#method",
          "text": "The fixture method runs a deterministic bridge action and records the generated\nSolar Evidence ABI artifact.",
          "title": "Method"
        },
        {
          "section_id": "results",
          "source_anchor": "sample_paper.md#results",
          "text": "The fixture path should produce a `result.json` file and an `evidence.jsonl`\nledger entry without invoking a monolithic AutoSci workflow owner.",
          "title": "Results"
        }
      ],
      "source_ref": "plugins/autosci/tests/fixtures/sample_paper.md",
      "source_type": "markdown",
      "title": "AutoSci Adapter Fixture Paper"
    }
  },
  "provenance": {
    "implementation_package": "plugins/autosci",
    "operator_id": "autosci-bridge",
    "timestamp": "2026-07-10T14:13:09Z"
  },
  "schema": "research_paper.v1",
  "sprint_id": "sprint-autosci-phase9",
  "status": "completed",
  "task_id": "task-autosci-ingest-fixture"
}
